{
  "title": "PRJ-INTERV360 — Interv360",
  "status": "In progress",
  "priority": "High",
  "health": "Green",
  "startDate": "2026-06-27",
  "summary": "Le cadrage Interv360 est consolidé après validation des 7 arbitrages MVP. Le périmètre MVP est stabilisé au niveau cadrage avec un noyau de 8 écrans, des contrats API documentés avec implémentation simulée, un canal email sécurisé cadré, une gestion d'erreurs visible avec reprise manuelle simulée, et un brief UX/UI validé avant préparation Figma.",
  "content": "## Gouvernance projet\n\n- **Phase actuelle** : 01-cadrage\n- **Statut cadrage** : consolidé / validé au niveau cadrage\n- **Source détaillée** : Cursor/Git — `projects/interv360/01-cadrage/`\n- **Notion** : référentiel de gouvernance (statuts, synthèses, traces)\n\n## Jalons atteints\n\n- MVP arbitrations validated\n- UX/UI brief validated\n\n## Prochaine étape\n\nPréparation Figma ou préparation ADR candidates.\n\n## Restriction de phase\n\nAucune architecture, backlog, user stories, maquettes ou Figma produits à ce stade.\n\n## Livrables de cadrage\n\n| Livrable | Statut | Source locale | Rôle |\n| Business Framing | Consolidated | business-framing.md | Cadrage métier consolidé |\n| Framing Review | Done | framing-review.md | Revue de cohérence |\n| MVP Arbitrations | Validated | mvp-arbitrations.md | Arbitrages MVP |\n| MVP Arbitration Validation | Validated | mvp-arbitration-validation.md | Validation finale MVP |\n| Integration & Error Arbitration Review | Done | integration-error-arbitration-review.md | Réinstruction intégrations / erreurs |\n| Secure Email Intake Review | Done | secure-email-intake-review.md | Clarification email sécurisé |\n| Dashboard KPI UX Review | Done | dashboard-kpi-ux-review.md | Clarification dashboard / KPI / UX |\n| UX/UI Brief | Validated | ux-ui-brief.md | Brief préalable Figma |\n| UX/UI Brief Validation | Validated | ux-ui-brief-validation.md | Validation fictive du brief |\n\n## Décisions MVP validées\n\n- ARB-MVP-01 : CRM principal ; saisie secours ; email sécurisé non principal.\n- ARB-MVP-02 : notifications uniquement ; portail ultérieur.\n- ARB-MVP-03 : signature optionnelle structurée.\n- ARB-MVP-04 : vrais contrats API documentés avec implémentation simulée.\n- ARB-MVP-05 : erreurs visibles + reprise manuelle ; retry hors MVP.\n- ARB-MVP-06 : conservation fictive RSSI / GreenOps documentée.\n- ARB-MVP-07 : noyau MVP 8 écrans avec dashboard complet et vue dirigeant.\n\n## Prochaines étapes\n\n- Traiter les points ouverts avant maquette.\n- Préparer Figma uniquement à partir du brief UX/UI validé.\n- Préparer les ADR candidates.\n- Détailler les règles de gestion si nécessaire.\n- Maintenir Notion comme référentiel de gouvernance et Git comme source documentaire détaillée."
}
