{
  "title": "PRJ-INTERV360 — Interv360",
  "status": "In progress",
  "priority": "High",
  "health": "Green",
  "startDate": "2026-06-27",
  "summary": "Clôture du jalon Figma V1 publiée en gouvernance. La maquette UX/UI V1 est validée comme présentable avec ajustements mineurs, non définitive. La V2 est différée. Le delivery, le backlog, les user stories et le code restent bloqués tant qu'un jalon dédié n'est pas explicitement ouvert.",
  "content": "## Clôture Figma V1\n\nLe jalon Figma V1 Interv360 est clôturé.\n\nLa maquette est validée comme présentable avec ajustements mineurs, non définitive, avec une qualité indicative de 8,3/10.\n\nLa V2 est différée.\n\nLe delivery reste bloqué tant qu'un jalon dédié n'est pas explicitement ouvert.\n\nAucun backlog, aucune user story et aucun code ne sont déclenchés par cette clôture.\n\n## Gouvernance projet\n\n- **Phase actuelle** : 02-architecture\n- **Jalon courant** : Figma V1 — Closed (validated with minor adjustments)\n- **Source détaillée** : Git — `projects/interv360/02-architecture/`\n- **Notion** : synthèse de gouvernance (cette mise à jour)\n\n## Capitalisation réalisée\n\n- Clôture du jalon Figma V1.\n- Standard officiel SFIA UX/UI V1 Governance v1.0.\n- Enrichissement du catalogue prompts avec la famille UX/UI V1 Governance.\n- Validation manuelle des 15 prompts candidats UX/UI V1 Governance.\n\n## Prochaine étape méthodologique\n\nOuverture du chantier QA / Testeur, dans une étape dédiée, sans déclencher delivery, backlog, user stories ou code.\n\n## Garde-fous\n\n- Pas de delivery ouvert.\n- Pas de backlog.\n- Pas de user stories.\n- Pas de code.\n- Pas de nouvelle maquette.\n- Pas de publication automatique.\n- Publication via CMP-001 uniquement après décision explicite et exécution manuelle.\n\n## Sources Git\n\n- `figma-v1-closure-summary.md`\n- `notion-sync-figma-v1-closure-payload.json` (payload gouvernance — non modifié)\n- `docs/standards/ux-ui-v1-governance-standard.md`"
}
