{
  "title": "PRJ-INTERV360 — Interv360",
  "status": "In progress",
  "priority": "High",
  "health": "Green",
  "startDate": "2026-06-27",
  "summary": "QA / Testeur — Méthode officielle créée et famille prompts QA validée comme candidate robuste. Publication gouvernance préparée sans ouverture delivery.",
  "content": "## QA / Testeur — Gouvernance SFIA\n\n### Statut\n\n- Méthode officielle QA / Testeur créée.\n- Famille prompts QA / Testeur créée.\n- Famille prompts QA validée comme candidate robuste.\n- Publication préparée en gouvernance.\n- Delivery toujours bloqué.\n\n## Méthode officielle QA / Testeur\n\n**Source** : `docs/methods/roles/qa-tester-method.md`\n\n**Synthèse** : Le rôle QA / Testeur est un rôle transverse SFIA de contribution à la qualité, la testabilité, la maîtrise des risques et la traçabilité.\n\nIl intervient dès les phases amont :\n\n- cadrage ;\n- conception ;\n- UX/UI ;\n- revues transverses ;\n- préparation éventuelle du delivery.\n\nIl ne déclenche pas seul :\n\n- delivery ;\n- backlog ;\n- user stories ;\n- code ;\n- recette officielle.\n\n## Famille prompts QA / Testeur\n\n**Sources** :\n\n- `prompts/qa/qa-tester-prompt-family.md`\n- `prompts/prompt-catalog.md` §14\n- `projects/interv360/02-architecture/prompt-catalog-qa-tester-validation.md`\n\n**Synthèse** : La famille QA / Testeur contient 10 prompts candidats.\n\n**Liste** :\n\n- PROMPT-QA-001 — Analyse de testabilité d'un besoin\n- PROMPT-QA-002 — Revue QA d'une maquette UX/UI\n- PROMPT-QA-003 — Questions réflexes QA en revue transverse\n- PROMPT-QA-004 — Lecture happy path / non happy path\n- PROMPT-QA-005 — Grille de risques qualité\n- PROMPT-QA-006 — Préparation légère d'une stratégie de test\n- PROMPT-QA-007 — Revue d'anomalie métier\n- PROMPT-QA-008 — Traçabilité besoin / critère / test futur / anomalie\n- PROMPT-QA-009 — Revue des critères d'acceptation futurs\n- PROMPT-QA-010 — Vérification des garde-fous QA\n\n## Validation prompts QA\n\n**Décision** : Famille QA / Testeur validée comme candidate robuste.\n\n**Bilan** :\n\n- 7 prompts validés ;\n- 3 prompts validés avec vigilance ;\n- 0 prompt à renforcer.\n\n**Prompts validés avec vigilance** :\n\n- PROMPT-QA-006 — éviter dérive vers stratégie de recette complète ;\n- PROMPT-QA-008 — éviter dérive vers matrice de tests détaillée ;\n- PROMPT-QA-009 — éviter dérive vers user stories ou backlog.\n\n## Garde-fous\n\n- Pas de delivery ouvert.\n- Pas de backlog.\n- Pas de user stories.\n- Pas de code.\n- Pas de scénarios de tests Interv360.\n- Pas de cas de tests détaillés.\n- Pas de stratégie de recette complète.\n- Git reste la source détaillée.\n- Notion reçoit uniquement une synthèse gouvernance.\n\n## Gouvernance projet\n\n- **Phase actuelle** : 02-architecture\n- **Chantier** : QA / Testeur — méthode officielle et prompts validés\n- **Source détaillée** : Git — `projects/interv360/02-architecture/`\n- **Notion** : synthèse de gouvernance (cette mise à jour)\n\n## Sources Git\n\n- `docs/methods/roles/qa-tester-method.md`\n- `prompts/qa/qa-tester-prompt-family.md`\n- `prompts/prompt-catalog.md`\n- `projects/interv360/02-architecture/prompt-catalog-qa-tester-validation.md`\n- `projects/interv360/02-architecture/notion-sync-qa-tester-governance-summary.md`\n- `projects/interv360/02-architecture/notion-sync-qa-tester-governance-payload.json`\n- `projects/interv360/02-architecture/notion-sync-qa-tester-governance-review.md`\n\n## Prochaine étape\n\nPublication CMP-001 autorisée uniquement dans une tâche dédiée, après validation du présent payload CMP-compatible.\n\n## Conclusion\n\nLa gouvernance QA / Testeur est prête pour publication CMP-001. La publication devra être exécutée séparément et tracée dans Git après succès."
}
